{
  "$schema": "https://json-schema.org/draft/2020-12/schema",
  "$id": "https://max-flow-optimizer.local/contracts/v1/solve.response.schema.json",
  "title": "SolveResponseV1",
  "type": "object",
  "additionalProperties": false,
  "required": [
    "instanceId",
    "feasible",
    "requiredFlow",
    "maxFlow",
    "assignments",
    "stats"
  ],
  "properties": {
    "runId": {
      "type": "string",
      "minLength": 1,
      "maxLength": 128
    },
    "createdAt": {
      "type": "string",
      "format": "date-time"
    },
    "instanceId": {
      "type": "string",
      "minLength": 1,
      "maxLength": 128
    },
    "feasible": {
      "type": "boolean"
    },
    "requiredFlow": {
      "type": "integer",
      "minimum": 0
    },
    "maxFlow": {
      "type": "integer",
      "minimum": 0
    },
    "assignments": {
      "type": "array",
      "items": {
        "type": "object",
        "additionalProperties": false,
        "required": [
          "dayId",
          "medicId",
          "periodId"
        ],
        "properties": {
          "dayId": {
            "type": "string",
            "minLength": 1,
            "maxLength": 128
          },
          "medicId": {
            "type": "string",
            "minLength": 1,
            "maxLength": 128
          },
          "periodId": {
            "type": "string",
            "minLength": 1,
            "maxLength": 128
          }
        }
      }
    },
    "stats": {
      "type": "object",
      "additionalProperties": false,
      "required": [
        "nodes",
        "edges",
        "runtimeMs"
      ],
      "properties": {
        "nodes": {
          "type": "integer",
          "minimum": 0
        },
        "edges": {
          "type": "integer",
          "minimum": 0
        },
        "runtimeMs": {
          "type": "integer",
          "minimum": 0
        },
        "augmentingPaths": {
          "type": "integer",
          "minimum": 0
        }
      }
    },
    "diagnostics": {
      "type": "object",
      "additionalProperties": false,
      "required": [
        "summaryCode",
        "message",
        "uncoveredDays"
      ],
      "properties": {
        "summaryCode": {
          "type": "string",
          "const": "INSUFFICIENT_COVERAGE"
        },
        "message": {
          "type": "string",
          "minLength": 1,
          "maxLength": 500
        },
        "uncoveredDays": {
          "type": "array",
          "uniqueItems": true,
          "items": {
            "type": "string",
            "minLength": 1,
            "maxLength": 128
          }
        }
      }
    }
  },
  "allOf": [
    {
      "if": {
        "properties": {
          "feasible": {
            "const": false
          }
        },
        "required": [
          "feasible"
        ]
      },
      "then": {
        "required": [
          "diagnostics"
        ],
        "properties": {
          "assignments": {
            "maxItems": 0
          }
        }
      },
      "else": {
        "not": {
          "required": [
            "diagnostics"
          ]
        }
      }
    }
  ]
}
